{
  "csv_dialect": {
    "encoding": "utf-8",
    "line_ending": "LF",
    "quote_all": true
  },
  "projections": [
    {
      "columns": [
        {"encoding": "scalar", "name": "id", "source": "id"},
        {"encoding": "scalar", "name": "semantic_key", "source": "semantic_key"},
        {"encoding": "scalar", "name": "title", "source": "title"},
        {"encoding": "canonical_json", "name": "target_locales_json", "source": "target_locales"},
        {"encoding": "canonical_json", "name": "course_ids_json", "source": "course_ids"},
        {"encoding": "scalar", "name": "rights_id", "source": "rights_id"},
        {"encoding": "scalar", "name": "status", "source": "status"},
        {"encoding": "record_json", "name": "record_json", "source": "$record"}
      ],
      "file_name": "programs.csv",
      "mode": "records",
      "name": "programs",
      "record_types": ["program"],
      "sort_by": ["id"]
    },
    {
      "columns": [
        {"encoding": "scalar", "name": "id", "source": "id"},
        {"encoding": "scalar", "name": "semantic_key", "source": "semantic_key"},
        {"encoding": "scalar", "name": "program_id", "source": "program_id"},
        {"encoding": "scalar", "name": "title", "source": "title"},
        {"encoding": "scalar", "name": "curriculum_role", "source": "curriculum_role"},
        {"encoding": "canonical_json", "name": "prerequisite_course_ids_json", "source": "prerequisite_course_ids"},
        {"encoding": "canonical_json", "name": "resource_ids_json", "source": "resource_ids"},
        {"encoding": "scalar", "name": "rights_id", "source": "rights_id"},
        {"encoding": "scalar", "name": "status", "source": "status"},
        {"encoding": "record_json", "name": "record_json", "source": "$record"}
      ],
      "file_name": "courses.csv",
      "mode": "records",
      "name": "courses",
      "record_types": ["course"],
      "sort_by": ["id"]
    },
    {
      "columns": [
        {"encoding": "scalar", "name": "id", "source": "id"},
        {"encoding": "scalar", "name": "semantic_key", "source": "semantic_key"},
        {"encoding": "scalar", "name": "title", "source": "title"},
        {"encoding": "canonical_json", "name": "creators_json", "source": "creators"},
        {"encoding": "scalar", "name": "original_language", "source": "original_language"},
        {"encoding": "scalar", "name": "upstream_uri", "source": "upstream_uri"},
        {"encoding": "scalar", "name": "repository_uri", "source": "repository_uri"},
        {"encoding": "scalar", "name": "rights_id", "source": "rights_id"},
        {"encoding": "scalar", "name": "status", "source": "status"},
        {"encoding": "record_json", "name": "record_json", "source": "$record"}
      ],
      "file_name": "resources.csv",
      "mode": "records",
      "name": "resources",
      "record_types": ["resource"],
      "sort_by": ["id"]
    },
    {
      "columns": [
        {"encoding": "scalar", "name": "id", "source": "id"},
        {"encoding": "scalar", "name": "semantic_key", "source": "semantic_key"},
        {"encoding": "scalar", "name": "resource_id", "source": "resource_id"},
        {"encoding": "scalar", "name": "edition_kind", "source": "edition_kind"},
        {"encoding": "scalar", "name": "revision_kind", "source": "revision.kind"},
        {"encoding": "scalar", "name": "revision_value", "source": "revision.value"},
        {"encoding": "scalar", "name": "commit_id", "source": "revision.commit_id"},
        {"encoding": "scalar", "name": "tree_id", "source": "revision.tree_id"},
        {"encoding": "scalar", "name": "archive_sha256", "source": "revision.archive_sha256"},
        {"encoding": "scalar", "name": "language", "source": "language"},
        {"encoding": "scalar", "name": "locale", "source": "locale"},
        {"encoding": "scalar", "name": "translation_state", "source": "translation_state"},
        {"encoding": "scalar", "name": "derivative_of_id", "source": "derivative_of_id"},
        {"encoding": "canonical_json", "name": "build_entrypoints_json", "source": "build_entrypoints"},
        {"encoding": "scalar", "name": "rights_id", "source": "rights_id"},
        {"encoding": "scalar", "name": "status", "source": "status"},
        {"encoding": "record_json", "name": "record_json", "source": "$record"}
      ],
      "file_name": "editions.csv",
      "mode": "records",
      "name": "editions",
      "record_types": ["edition"],
      "sort_by": ["resource_id", "id"]
    },
    {
      "columns": [
        {"encoding": "scalar", "name": "id", "source": "id"},
        {"encoding": "scalar", "name": "semantic_key", "source": "semantic_key"},
        {"encoding": "scalar", "name": "resource_id", "source": "resource_id"},
        {"encoding": "scalar", "name": "edition_id", "source": "edition_id"},
        {"encoding": "scalar", "name": "unit_kind", "source": "unit_kind"},
        {"encoding": "scalar", "name": "source_local_id", "source": "source_local_id"},
        {"encoding": "scalar", "name": "parent_id", "source": "parent_id"},
        {"encoding": "scalar", "name": "order_key", "source": "order_key"},
        {"encoding": "scalar", "name": "label", "source": "label"},
        {"encoding": "scalar", "name": "title", "source": "title"},
        {"encoding": "scalar", "name": "source_path", "source": "source_binding.source_path"},
        {"encoding": "scalar", "name": "source_locator", "source": "source_binding.locator"},
        {"encoding": "scalar", "name": "source_content_sha256", "source": "source_binding.content_sha256"},
        {"encoding": "canonical_json", "name": "locale_states_json", "source": "locale_states"},
        {"encoding": "canonical_json", "name": "concept_ids_json", "source": "concept_ids"},
        {"encoding": "canonical_json", "name": "prerequisite_ids_json", "source": "prerequisite_ids"},
        {"encoding": "scalar", "name": "solution_status", "source": "exercise_metadata.solution_status"},
        {"encoding": "scalar", "name": "rights_id", "source": "rights_id"},
        {"encoding": "scalar", "name": "status", "source": "status"},
        {"encoding": "record_json", "name": "record_json", "source": "$record"}
      ],
      "file_name": "units.csv",
      "mode": "records",
      "name": "units",
      "record_types": ["unit"],
      "sort_by": ["resource_id", "order_key", "id"]
    },
    {
      "columns": [
        {"encoding": "scalar", "name": "id", "source": "id"},
        {"encoding": "scalar", "name": "semantic_key", "source": "semantic_key"},
        {"encoding": "scalar", "name": "label", "source": "label"},
        {"encoding": "scalar", "name": "definition", "source": "definition"},
        {"encoding": "canonical_json", "name": "notation_json", "source": "notation"},
        {"encoding": "canonical_json", "name": "source_bindings_json", "source": "source_bindings"},
        {"encoding": "scalar", "name": "rights_id", "source": "rights_id"},
        {"encoding": "scalar", "name": "status", "source": "status"},
        {"encoding": "record_json", "name": "record_json", "source": "$record"}
      ],
      "file_name": "concepts.csv",
      "mode": "records",
      "name": "concepts",
      "record_types": ["concept"],
      "sort_by": ["id"]
    },
    {
      "columns": [
        {"encoding": "scalar", "name": "id", "source": "id"},
        {"encoding": "scalar", "name": "semantic_key", "source": "semantic_key"},
        {"encoding": "scalar", "name": "unit_id", "source": "unit_id"},
        {"encoding": "scalar", "name": "segment_kind", "source": "segment_kind"},
        {"encoding": "scalar", "name": "order_key", "source": "order_key"},
        {"encoding": "scalar", "name": "source_path", "source": "source_binding.source_path"},
        {"encoding": "scalar", "name": "source_locator", "source": "source_binding.locator"},
        {"encoding": "scalar", "name": "source_content_sha256", "source": "source_binding.content_sha256"},
        {"encoding": "canonical_json", "name": "expressions_json", "source": "expressions"},
        {"encoding": "canonical_json", "name": "concept_ids_json", "source": "concept_ids"},
        {"encoding": "scalar", "name": "rights_id", "source": "rights_id"},
        {"encoding": "scalar", "name": "status", "source": "status"},
        {"encoding": "record_json", "name": "record_json", "source": "$record"}
      ],
      "file_name": "segments.csv",
      "mode": "records",
      "name": "segments",
      "record_types": ["segment"],
      "sort_by": ["unit_id", "order_key", "id"]
    },
    {
      "columns": [
        {"encoding": "scalar", "name": "id", "source": "id"},
        {"encoding": "scalar", "name": "semantic_key", "source": "semantic_key"},
        {"encoding": "scalar", "name": "concept_id", "source": "concept_id"},
        {"encoding": "scalar", "name": "language", "source": "language"},
        {"encoding": "scalar", "name": "locale", "source": "locale"},
        {"encoding": "scalar", "name": "preferred", "source": "preferred"},
        {"encoding": "canonical_json", "name": "variants_json", "source": "variants"},
        {"encoding": "canonical_json", "name": "rejected_forms_json", "source": "rejected_forms"},
        {"encoding": "canonical_json", "name": "scope_ids_json", "source": "scope_ids"},
        {"encoding": "scalar", "name": "register", "source": "register"},
        {"encoding": "canonical_json", "name": "evidence_json", "source": "evidence"},
        {"encoding": "scalar", "name": "rights_id", "source": "rights_id"},
        {"encoding": "scalar", "name": "status", "source": "status"},
        {"encoding": "record_json", "name": "record_json", "source": "$record"}
      ],
      "file_name": "terms.csv",
      "mode": "records",
      "name": "terms",
      "record_types": ["term"],
      "sort_by": ["locale", "preferred", "id"]
    },
    {
      "columns": [
        {"encoding": "scalar", "name": "id", "source": "id"},